{
  "$schema": "http://json-schema.org/draft-07/schema#",
  "$id": "https://raw.githubusercontent.com/anonymous/little-mester/ticket-engine/v1.0/ticket-v1.json",
  "title": "Ticket v1 Schema",
  "description": "Validates ticket-NNN.json files against the current little-mester ticketing engine schema per SCHEMA.md and DECISIONS field semantics (D.1-D.4, E). type is a top-level enum with 6 values, NOT a label set (per D.2 resolution). priority is the primary triage signal (per H decision). labels use prefix/value format with scope/severity predefined sets plus user/* free-form.",

  "type": "object",
  "required": ["number", "area", "type", "status", "title", "created_at", "updated_at"],
  "additionalProperties": true,
  "properties": {
    "$schema": {
      "type": "string",
      "format": "uri"
    },
    "number": {
      "type": "integer",
      "minimum": 1,
      "description": "Auto-incremented unique ticket identifier. Never recycled when tickets are deleted."
    },
    "area": {
      "type": "string",
      "minLength": 1,
      "description": "Human grouping domain for the ticket. Set on creation and not changed after (if domain changes, create new ticket in correct area per DECISIONS D.1)."
    },
    "type": {
      "type": "string",
      "enum": ["spike", "feature", "bug", "improvement", "doc", "infra"],
      "description": "Kind of work. spike=research only (no code), feature=new functionality, bug=defect fix, improvement=non-functional enhancement, doc=documentation-only, infra=infrastructure changes. Per DECISIONS D.2."
    },
    "status": {
      "type": "string",
      "enum": ["draft", "active", "resolved", "archived"],
      "description": "Lifecycle state (DECISIONS D.3). Valid transitions: draft→active, active→resolved, resolved→draft, any→archived, draft↔active. archived has NO outgoing transitions."
    },
    "title": {
      "type": "string",
      "minLength": 1,
      "description": "One-line human-readable summary of the ticket objective."
    },
    "objective": {
      "type": ["string", "null"],
      "description": "Detailed objective in present/future tense. Optional when creating a spike or initial draft."
    },
    "created_at": {
      "type": "string",
      "format": "date-time",
      "description": "Immutable ISO-8601 creation timestamp."
    },
    "updated_at": {
      "type": "string",
      "format": "date-time",
      "description": "ISO-8601 timestamp of last modification. Updated on every field change including status transitions."
    },
    "priority": {
      "type": ["string", "null"],
      "enum": ["trivial", "major", "minor", "critical"],
      "description": "Primary triage signal for sorting and board views (DECISIONS H). Different from severity label: priority controls machine-readable sort order; severity/critical label composes with other labels in multi-criteria queries."
    },
    "labels": {
      "type": ["array", "null"],
      "items": {
        "type": "string"
      },
      "description": "Cross-cutting categorization tags in prefix/value format. Valid prefixes with validation: scope (agent,engine,infra,docs,tests,security,performance), severity (trivial,minor,major,critical). All other values must start with 'user/' — validated only for prefix match, stored verbatim.",
      "minItems": 1,
      "uniqueItems": true
    },
    "dependencies": {
      "type": ["array", "null"],
      "items": { "type": "integer" },
      "description": "Other ticket numbers this one depends on (resolved before this can progress to active)."
    },
    "blocked_by": {
      "type": ["array", "null"],
      "items": { "type": "integer" },
      "description": "Inverse of dependencies — tickets that block this one. Auto-generated by engine."
    },
    "parent": {
      "type": ["integer", "null"],
      "description": "Epic number this ticket belongs to, or null if it is not a child of any epic."
    },
    "is_epic": {
      "type": "boolean",
      "description": "Auto-set when created as epic. Marks the ticket as a grouping ticket with its own lifecycle and composite status from children (auto-computed on read, NOT persisted to file)."
    },
    "estimate": {
      "type": ["number", "null"],
      "description": "Effort estimate in hours or story points."
    },
    "estimated_model": {
      "type": ["string", "null"],
      "description": "Which local model was used when the estimate was made. Records estimator context — different from suggested_model which is a recommendation based on area history."
    },
    "suggested_model": {
      "type": ["string", "null"],
      "description": "Model recommended for this work type based on historical models_used[] data from other tickets in the same area. Auto-computed, overridable at creation. Per DECISIONS E."
    },
    "estimated_models": {
      "type": ["array", "null"],
      "items": {
        "type": "object",
        "required": ["model", "subtask_hint"],
        "properties": {
          "model": { "type": "string" },
          "subtask_hint": { "type": "string" }
        },
        "additionalProperties": false
      },
      "description": "Projected model split for complex tickets — each object represents a subtask with its suggested model. Set during estimation phase (post-spike). Per DECISIONS E."
    },
    "models_used": {
      "type": ["array", "null"],
      "items": {
        "type": "object",
        "required": ["model", "thinking_time_seconds", "idle_time_seconds"],
        "properties": {
          "model": {
            "type": "string",
            "description": "e.g., 'qwen3.6:35b-a3b'"
          },
          "thinking_time_seconds": {
            "type": "number",
            "minimum": 0,
            "description": "How long the model was THINKING (not idle)."
          },
          "idle_time_seconds": {
            "type": "number",
            "minimum": 0,
            "description": "Time waiting for input/prompts (tracked separately from thinking time)."
          },
          "cost_estimate_usd": {
            "type": ["number", "null"],
            "minimum": 0,
            "description": "Estimated cost based on token usage."
          },
          "context_window_used_pct": {
            "type": ["number", "null"],
            "minimum": 0,
            "maximum": 100,
            "description": "Percentage of context window consumed (0-100)."
          }
        },
        "additionalProperties": false
      },
      "description": "Per-model usage statistics from actual work done on this ticket. Automatically populated by opencode at session end — user does NOT fill in. See DECISIONS E."
    },
    "comments": {
      "type": ["array", "null"],
      "items": {
        "type": "object",
        "properties": {
          "author": { "type": "string" },
          "body": { "type": "string" },
          "created_at": { "type": "string", "format": "date-time" }
        },
        "additionalProperties": false
      },
      "description": "Timestamped notes/ comments on the ticket."
    },
    "attachments": {
      "type": ["array", "null"],
      "items": { "type": "string" },
      "description": "File paths linked to the ticket."
    },
    "spans": {
      "anyOf": [
        {
          "type": "object",
          "required": ["start", "end"],
          "properties": {
            "start": { "type": "string", "format": "date-time" },
            "end": { "type": "string", "format": "date-time" }
          },
          "additionalProperties": false
        },
        { "type": "null" }
      ],
      "description": "Date range tracking for the ticket, or null if no span is specified."
    },
    "assigned_to": {
      "type": ["string", "null"],
      "description": "Who is responsible (user or agent identifier). Free-form — not a lookup against a user directory."
    },
    "links": {
      "type": ["array", "null"],
      "items": {
        "type": "object",
        "required": ["target", "type"],
        "properties": {
          "target": { "type": "integer", "description": "Target ticket number" },
          "type": { "type": "string", "description": "Relationship type (blocks, blocked-by, relates-to, duplicates, etc.)" }
        },
        "additionalProperties": false
      },
      "description": "Typed relationships to other tickets. Per DECISIONS D.3."
    },
    "subtickets": {
      "type": ["array", "null"],
      "items": {
        "type": "object",
        "required": ["id", "title", "status"],
        "properties": {
          "id": { "type": "integer" },
          "title": { "type": "string" },
          "status": { "type": "string", "enum": ["draft", "active", "resolved", "archived"] }
        },
        "additionalProperties": false
      },
      "description": "Subticket tree for hierarchical decomposition. Each subticket is a lightweight child entry."
    },
    "notes": {
      "type": ["string", "null"],
      "description": "Free-form notes on the ticket. Distinct from comments which are timestamped with author."
    }
  },

  "dependencies": {
    "priority": "labels must include priority-equivalent if priority is set but no severity label exists; however the engine allows both independently per DECISIONS H decision",
    "estimated_models": "only meaningful when estimate is also set"
  }
}
