{
  "$schema": "https://raw.githubusercontent.com/little-mester/ticket-engine/v1.0/docs/SCHEMA.md",
  "number": 10,
  "area": "general",
  "type": "feature",
  "status": "draft",
  "title": "Multi-field search, ticket dependencies, epics (real tickets), and label system",
  "objective": "Implement the engine's query layer, relationship graph, and epic tracking — multi-field search, ticket dependencies, epics as real ticket types, and label system.",
  "created_at": "2026-10-20T09:09:49.607Z",
  "updated_at": "2026-10-20T09:09:49.607Z"
}
