{
  "$schema": "https://raw.githubusercontent.com/little-mester/ticket-engine/v1.0/docs/SCHEMA.md",
  "number": 8,
  "area": "engine",
  "type": "feature",
  "status": "resolved",
  "title": "Fix engine.ts syntax errors to make project compilable",
  "objective": "",
  "created_at": "2026-10-20T09:09:49.606Z",
  "updated_at": "2026-10-20T09:09:49.606Z"
}
