{
  "$schema": "https://raw.githubusercontent.com/little-mester/ticket-engine/v1.0/docs/SCHEMA.md",
  "number": 6,
  "area": "general",
  "type": "feature",
  "status": "draft",
  "title": "Document workflow & update checklists",
  "objective": "",
  "created_at": "2026-10-20T09:09:49.606Z",
  "updated_at": "2026-10-20T09:09:49.606Z"
}
